[
  {
    "id": "rusty_row",
    "unlock_net_worth": 0,
    "lockers_per_day": 3,
    "opening_factor": 0.3,
    "opening_noise": [0.7, 1.3],
    "themes": {"attic_clearout": 1, "gamers_den": 1, "contractors_garage": 1},
    "rarity_weights": {"common": 70, "uncommon": 22, "rare": 6.5, "epic": 1.2, "legendary": 0.3},
    "rivals": ["finn", "marla", "cass"],
    "rival_budget_factor": 1.0
  }
]
